{
  "$schema": "http://json-schema.org/draft-07/schema#",
  "title": "LoopSail Task List v2",
  "type": "object",
  "additionalProperties": false,
  "required": [
    "schema_version",
    "kind",
    "list_id",
    "project",
    "final_verify_commands",
    "tasks"
  ],
  "properties": {
    "schema_version": {
      "const": 2
    },
    "kind": {
      "const": "task-list"
    },
    "$schema": {
      "type": "string",
      "minLength": 1
    },
    "list_id": {
      "type": "string",
      "pattern": "^[A-Za-z][A-Za-z0-9._-]{0,63}$"
    },
    "project": {
      "type": "string",
      "minLength": 1
    },
    "final_verify_commands": {
      "type": "array",
      "minItems": 1,
      "items": {
        "$ref": "#/definitions/command"
      }
    },
    "tasks": {
      "type": "array",
      "minItems": 1,
      "items": {
        "$ref": "#/definitions/task"
      }
    }
  },
  "definitions": {
    "command": {
      "type": "object",
      "additionalProperties": false,
      "required": [
        "argv"
      ],
      "properties": {
        "argv": {
          "type": "array",
          "minItems": 1,
          "items": {
            "type": "string",
            "minLength": 1
          }
        },
        "cwd": {
          "type": "string",
          "default": "."
        },
        "timeout_seconds": {
          "type": "integer",
          "minimum": 1,
          "default": 900
        }
      }
    },
    "task": {
      "type": "object",
      "additionalProperties": false,
      "required": [
        "id",
        "title",
        "description",
        "depends_on",
        "context_files",
        "acceptance",
        "verify_commands"
      ],
      "properties": {
        "id": {
          "type": "string",
          "pattern": "^[A-Za-z][A-Za-z0-9._-]{0,63}$"
        },
        "title": {
          "type": "string",
          "minLength": 1
        },
        "description": {
          "type": "string",
          "minLength": 1
        },
        "depends_on": {
          "type": "array",
          "uniqueItems": true,
          "items": {
            "type": "string",
            "minLength": 1
          }
        },
        "context_files": {
          "type": "array",
          "minItems": 1,
          "uniqueItems": true,
          "items": {
            "type": "string",
            "minLength": 1
          }
        },
        "acceptance": {
          "type": "array",
          "minItems": 1,
          "items": {
            "type": "string",
            "minLength": 1
          }
        },
        "verify_commands": {
          "type": "array",
          "minItems": 1,
          "items": {
            "$ref": "#/definitions/command"
          }
        },
        "allowed_paths": {
          "type": "array",
          "minItems": 1,
          "uniqueItems": true,
          "items": {
            "type": "string",
            "minLength": 1
          }
        },
        "source_refs": {
          "type": "array",
          "uniqueItems": true,
          "items": {
            "type": "string",
            "minLength": 1
          }
        },
        "non_goals": {
          "type": "array",
          "items": {
            "type": "string",
            "minLength": 1
          }
        },
        "stop_conditions": {
          "type": "array",
          "items": {
            "type": "string",
            "minLength": 1
          }
        }
      }
    }
  }
}
